[
  {
    "id": "soft_drink",
    "name": "Soft Drink",
    "tier": "finished",
    "category": "beverage",
    "unit": "bottle",
    "baseWorldMarketPrice": 1.1,
    "priceElasticity": 0.8,
    "maxTechLevel": 8,
    "baseDemandPerCapita": {
      "low": 24,
      "middle": 26,
      "high": 22
    },
    "referencePrice": 1.75,
    "wtpSigma": 0.45,
    "offerElasticity": 5.0,
    "valueSpread": 0.7,
    "attributeWeights": {
      "quality": 0.2,
      "brand": 0.65,
      "tech": 0.15
    },
    "incumbent": {
      "brand": 45,
      "quality": 50
    },
    "importBrand": 45,
    "retailCategory": "grocery",
    "referenceStore": "supermarket",
    "importMultiplier": 1.12,
    "exportMultiplier": 0.93,
    "worldMarketDepth": 3000000,
    "recipe": {
      "outputQuantity": 1.0,
      "laborUnits": 4.4,
      "inputs": [
        {
          "productId": "sugar",
          "quantity": 0.05
        },
        {
          "productId": "plastic",
          "quantity": 0.022
        }
      ],
      "outputPerSlotMonth": 1500000,
      "laborPerSlot": 22,
      "otherCostPerUnit": 0.71,
      "kwhPerUnit": 0.03,
      "lineCapex": 8000000
    }
  },
  {
    "id": "bread",
    "name": "Bread",
    "tier": "finished",
    "category": "food",
    "unit": "loaf",
    "baseWorldMarketPrice": 1.95,
    "priceElasticity": 0.35,
    "maxTechLevel": 7,
    "baseDemandPerCapita": {
      "low": 6.5,
      "middle": 6.0,
      "high": 5.0
    },
    "referencePrice": 3.2,
    "wtpSigma": 0.35,
    "offerElasticity": 5.0,
    "valueSpread": 0.6,
    "attributeWeights": {
      "quality": 0.6,
      "brand": 0.3,
      "tech": 0.1
    },
    "incumbent": {
      "brand": 30,
      "quality": 50
    },
    "importBrand": 30,
    "retailCategory": "grocery",
    "referenceStore": "supermarket",
    "importMultiplier": 1.35,
    "exportable": false,
    "recipe": {
      "outputQuantity": 1.0,
      "laborUnits": 6.0,
      "inputs": [
        {
          "productId": "flour",
          "quantity": 0.45
        }
      ],
      "outputPerSlotMonth": 450000,
      "laborPerSlot": 30,
      "otherCostPerUnit": 0.82,
      "kwhPerUnit": 0.3,
      "lineCapex": 4500000
    }
  },
  {
    "id": "t_shirt",
    "name": "T-Shirt",
    "tier": "finished",
    "category": "apparel",
    "unit": "unit",
    "baseWorldMarketPrice": 7.0,
    "priceElasticity": 0.9,
    "maxTechLevel": 9,
    "baseDemandPerCapita": {
      "low": 1.2,
      "middle": 1.4,
      "high": 1.6
    },
    "referencePrice": 15.0,
    "wtpSigma": 0.55,
    "offerElasticity": 3.0,
    "valueSpread": 0.8,
    "attributeWeights": {
      "quality": 0.4,
      "brand": 0.45,
      "tech": 0.15
    },
    "incumbent": {
      "brand": 35,
      "quality": 50
    },
    "importBrand": 35,
    "retailCategory": "apparel",
    "referenceStore": "department_store",
    "importMultiplier": 1.12,
    "exportMultiplier": 0.93,
    "worldMarketDepth": 240000,
    "recipe": {
      "outputQuantity": 1.0,
      "laborUnits": 6.0,
      "inputs": [
        {
          "productId": "cotton_fabric",
          "quantity": 0.035
        }
      ],
      "outputPerSlotMonth": 120000,
      "laborPerSlot": 30,
      "otherCostPerUnit": 1.22,
      "kwhPerUnit": 0.4,
      "lineCapex": 1500000
    }
  },
  {
    "id": "television",
    "name": "Television",
    "tier": "finished",
    "category": "electronics",
    "unit": "unit",
    "baseWorldMarketPrice": 345,
    "priceElasticity": 1.3,
    "maxTechLevel": 12,
    "baseDemandPerCapita": {
      "low": 0.009,
      "middle": 0.012,
      "high": 0.016
    },
    "referencePrice": 480,
    "wtpSigma": 0.55,
    "offerElasticity": 6.0,
    "valueSpread": 0.7,
    "attributeWeights": {
      "quality": 0.3,
      "brand": 0.25,
      "tech": 0.45
    },
    "incumbent": {
      "brand": 45,
      "quality": 50
    },
    "importBrand": 45,
    "retailCategory": "electronics",
    "referenceStore": "department_store",
    "importMultiplier": 1.08,
    "exportMultiplier": 0.94,
    "worldMarketDepth": 20000,
    "recipe": {
      "outputQuantity": 1.0,
      "laborUnits": 8.0,
      "inputs": [
        {
          "productId": "electronic_parts",
          "quantity": 20
        },
        {
          "productId": "plastic",
          "quantity": 5
        },
        {
          "productId": "steel",
          "quantity": 0.008
        }
      ],
      "outputPerSlotMonth": 10000,
      "laborPerSlot": 40,
      "otherCostPerUnit": 38.2,
      "kwhPerUnit": 15,
      "lineCapex": 10000000
    }
  },
  {
    "id": "car",
    "name": "Car",
    "tier": "finished",
    "category": "automotive",
    "unit": "unit",
    "baseWorldMarketPrice": 30500,
    "priceElasticity": 1.1,
    "maxTechLevel": 12,
    "baseDemandPerCapita": {
      "low": 0.0025,
      "middle": 0.0042,
      "high": 0.007
    },
    "referencePrice": 35000,
    "wtpSigma": 0.5,
    "offerElasticity": 8.0,
    "valueSpread": 0.6,
    "attributeWeights": {
      "quality": 0.35,
      "brand": 0.3,
      "tech": 0.35
    },
    "incumbent": {
      "brand": 50,
      "quality": 50
    },
    "importBrand": 50,
    "retailCategory": "auto",
    "referenceStore": "car_dealership",
    "importMultiplier": 1.04,
    "exportMultiplier": 0.95,
    "worldMarketDepth": 600,
    "recipe": {
      "outputQuantity": 1.0,
      "laborUnits": 12.0,
      "inputs": [
        {
          "productId": "steel",
          "quantity": 1.0
        },
        {
          "productId": "plastic",
          "quantity": 160
        },
        {
          "productId": "electronic_parts",
          "quantity": 350
        }
      ],
      "outputPerSlotMonth": 300,
      "laborPerSlot": 60,
      "otherCostPerUnit": 20500,
      "kwhPerUnit": 900,
      "lineCapex": 35000000
    }
  },
  {
    "id": "beer",
    "name": "Beer",
    "tier": "finished",
    "category": "beverage",
    "unit": "bottle",
    "baseWorldMarketPrice": 1.12,
    "priceElasticity": 0.6,
    "maxTechLevel": 9,
    "baseDemandPerCapita": {
      "low": 12,
      "middle": 13,
      "high": 11
    },
    "referencePrice": 1.9,
    "wtpSigma": 0.45,
    "offerElasticity": 5.0,
    "valueSpread": 0.7,
    "attributeWeights": {
      "quality": 0.3,
      "brand": 0.6,
      "tech": 0.1
    },
    "incumbent": {
      "brand": 45,
      "quality": 50
    },
    "importBrand": 45,
    "retailCategory": "grocery",
    "referenceStore": "supermarket",
    "importMultiplier": 1.12,
    "exportMultiplier": 0.93,
    "worldMarketDepth": 2000000,
    "recipe": {
      "outputQuantity": 1.0,
      "laborUnits": 4.4,
      "inputs": [
        {
          "productId": "malt",
          "quantity": 0.06
        },
        {
          "productId": "hops",
          "quantity": 7e-07
        },
        {
          "productId": "plastic",
          "quantity": 0.004
        }
      ],
      "outputPerSlotMonth": 1000000,
      "laborPerSlot": 22,
      "otherCostPerUnit": 0.62,
      "kwhPerUnit": 0.1,
      "lineCapex": 9000000
    }
  },
  {
    "id": "coffee_drink",
    "name": "Coffee Drink",
    "tier": "finished",
    "category": "beverage",
    "unit": "cup",
    "baseWorldMarketPrice": 1.85,
    "priceElasticity": 0.6,
    "maxTechLevel": 8,
    "baseDemandPerCapita": {
      "low": 4,
      "middle": 8,
      "high": 12
    },
    "referencePrice": 3.25,
    "wtpSigma": 0.5,
    "offerElasticity": 4.0,
    "valueSpread": 0.7,
    "attributeWeights": {
      "quality": 0.4,
      "brand": 0.45,
      "tech": 0.15
    },
    "incumbent": {
      "brand": 40,
      "quality": 50
    },
    "importBrand": 40,
    "retailCategory": "grocery",
    "referenceStore": "supermarket",
    "importMultiplier": 1.2,
    "exportable": false,
    "recipe": {
      "outputQuantity": 1.0,
      "laborUnits": 4.4,
      "inputs": [
        {
          "productId": "roasted_coffee",
          "quantity": 0.015
        },
        {
          "productId": "plastic",
          "quantity": 0.025
        }
      ],
      "outputPerSlotMonth": 600000,
      "laborPerSlot": 22,
      "otherCostPerUnit": 0.94,
      "kwhPerUnit": 0.06,
      "lineCapex": 6000000
    }
  },
  {
    "id": "designer_jeans",
    "name": "Designer Jeans",
    "tier": "finished",
    "category": "apparel",
    "unit": "unit",
    "baseWorldMarketPrice": 55.0,
    "priceElasticity": 1.3,
    "maxTechLevel": 10,
    "baseDemandPerCapita": {
      "low": 0,
      "middle": 0.08,
      "high": 0.2
    },
    "referencePrice": 130.0,
    "wtpSigma": 0.6,
    "offerElasticity": 2.5,
    "valueSpread": 1.0,
    "attributeWeights": {
      "quality": 0.25,
      "brand": 0.7,
      "tech": 0.05
    },
    "incumbent": {
      "brand": 55,
      "quality": 55
    },
    "importBrand": 55,
    "retailCategory": "apparel",
    "referenceStore": "department_store",
    "importMultiplier": 1.12,
    "exportMultiplier": 0.93,
    "worldMarketDepth": 24000,
    "recipe": {
      "outputQuantity": 1.0,
      "laborUnits": 7.2,
      "inputs": [
        {
          "productId": "denim_fabric",
          "quantity": 0.04
        }
      ],
      "outputPerSlotMonth": 12000,
      "laborPerSlot": 36,
      "otherCostPerUnit": 11.75,
      "kwhPerUnit": 1.5,
      "lineCapex": 2500000
    }
  }
]
